{
  "unitId": "EN-A1-PRONOUNS-01",
  "title": "Pronouns",
  "level": "A1",
  "language": "en",
  "leadIn": {
    "title": "Lead-In & Context: Pronouns",
    "content": "Replacing nouns in a sentence: John bought flowers for Mary. He gave them to her yesterday."
  },
  "meaningCheck": [
    {
      "question": "Function check: What is the primary purpose of using Pronouns?",
      "targetStructure": "pronouns",
      "options": [
        "To express clear, level-appropriate meaning in structured context",
        "To translate sentences word-for-word from another language",
        "It is an obsolete form never used by native speakers"
      ],
      "correctOptionIndex": 0,
      "explanation": "Correct · This structure provides explicit grammatical function and clarity."
    },
    {
      "question": "Form check: Does correct usage of Pronouns require matching subject, verb, and modifier agreements?",
      "targetStructure": "pronouns",
      "options": [
        "No, agreement rules are optional in English",
        "Yes, matching grammatical forms ensures natural, accurate communication",
        "Agreement only matters in formal academic writing"
      ],
      "correctOptionIndex": 1,
      "explanation": "Correct · Accurate form and agreement choices prevent misunderstandings."
    }
  ],
  "form": {
    "title": "Form & Structure: Pronouns",
    "content": "Subject pronouns (I, you, he, she, it, we, they) do the action. Object pronouns (me, you, him, her, it, us, them) receive the action."
  },
  "pronunciation": {
    "title": "Pronunciation Notes: Pronouns",
    "content": "Spoken stress, weak forms, intonation, and articulation patterns for Pronouns."
  },
  "controlledPractice": [
    {
      "question": "Choose the correct possessive pronoun: 'This bag is ___.'",
      "targetStructure": "pronouns",
      "options": [
        "her",
        "hers",
        "she"
      ],
      "correctOptionIndex": 1,
      "explanation": "Possessive pronouns (mine, yours, his, hers, ours, theirs) stand alone, without a noun after them."
    },
    {
      "question": "Which is correct?",
      "targetStructure": "pronouns",
      "options": [
        "Me am happy.",
        "I am happy.",
        "I is happy."
      ],
      "correctOptionIndex": 1,
      "explanation": "The subject pronoun is I, and it pairs with am: I am happy."
    },
    {
      "question": "'The dog wags ___ tail.' Which word fits?",
      "targetStructure": "pronouns",
      "options": [
        "it's",
        "its",
        "it"
      ],
      "correctOptionIndex": 1,
      "explanation": "'Its' (no apostrophe) is the possessive adjective for 'it'."
    }
  ],
  "freerPractice": {
    "title": "Freer Practice: Pronouns",
    "content": "Guided communicative exchanges applying Pronouns in everyday conversation.",
    "links": [
      "COSYgames/scene_match"
    ]
  },
  "production": {
    "title": "Communicative Production: Pronouns",
    "content": "Independent oral production and real-world task execution using Pronouns.",
    "links": [
      "COSYevents/speaking-club"
    ]
  }
}
