{
  "unitId": "EN-A1-PART-3-ARTICLES-DETERMINERS-01",
  "title": "Articles & Determiners",
  "level": "A1",
  "language": "en",
  "leadIn": {
    "title": "Lead-In & Context: Articles & Determiners",
    "content": "Specifying nouns: Put some apples in the basket, but leave that banana on the table."
  },
  "meaningCheck": [
    {
      "question": "Function check: What is the primary purpose of using Articles & Determiners?",
      "targetStructure": "part-3-articles-determiners",
      "options": [
        "To express clear, level-appropriate meaning in structured context",
        "To translate sentences word-for-word from another language",
        "It is an obsolete form never used by native speakers"
      ],
      "correctOptionIndex": 0,
      "explanation": "Correct · This structure provides explicit grammatical function and clarity."
    },
    {
      "question": "Form check: Does correct usage of Articles & Determiners require matching subject, verb, and modifier agreements?",
      "targetStructure": "part-3-articles-determiners",
      "options": [
        "No, agreement rules are optional in English",
        "Yes, matching grammatical forms ensures natural, accurate communication",
        "Agreement only matters in formal academic writing"
      ],
      "correctOptionIndex": 1,
      "explanation": "Correct · Accurate form and agreement choices prevent misunderstandings."
    }
  ],
  "form": {
    "title": "Form & Structure: Articles & Determiners",
    "content": "Articles (a, an, the) + Determiners (this, that, some, any, my, your) before nouns to define quantity or identity."
  },
  "pronunciation": {
    "title": "Pronunciation Notes: Articles & Determiners",
    "content": "Spoken stress, weak forms, intonation, and articulation patterns for Articles & Determiners."
  },
  "controlledPractice": [],
  "freerPractice": {
    "title": "Freer Practice: Articles & Determiners",
    "content": "Guided communicative exchanges applying Articles & Determiners in everyday conversation.",
    "links": [
      "COSYgames/scene_match"
    ]
  },
  "production": {
    "title": "Communicative Production: Articles & Determiners",
    "content": "Independent oral production and real-world task execution using Articles & Determiners.",
    "links": [
      "COSYevents/speaking-club"
    ]
  }
}
