{
  "unitId": "EN-A1-WORD-ORDER-01",
  "title": "Basic Word Order",
  "level": "A1",
  "language": "en",
  "leadIn": {
    "title": "Lead-In & Context: Basic Word Order",
    "content": "Building standard English sentences: Subject comes first, followed by the verb, the object, and finally place or time."
  },
  "meaningCheck": [
    {
      "question": "Function check: What is the primary purpose of using Basic Word Order?",
      "targetStructure": "word-order",
      "options": [
        "To express clear, level-appropriate meaning in structured context",
        "To translate sentences word-for-word from another language",
        "It is an obsolete form never used by native speakers"
      ],
      "correctOptionIndex": 0,
      "explanation": "Correct · This structure provides explicit grammatical function and clarity."
    },
    {
      "question": "Form check: Does correct usage of Basic Word Order require matching subject, verb, and modifier agreements?",
      "targetStructure": "word-order",
      "options": [
        "No, agreement rules are optional in English",
        "Yes, matching grammatical forms ensures natural, accurate communication",
        "Agreement only matters in formal academic writing"
      ],
      "correctOptionIndex": 1,
      "explanation": "Correct · Accurate form and agreement choices prevent misunderstandings."
    }
  ],
  "form": {
    "title": "Form & Structure: Basic Word Order",
    "content": "Subject + Verb + Object + Place + Time (e.g. She [S] bought [V] a coat [O] at the mall [P] yesterday [T])."
  },
  "pronunciation": {
    "title": "Pronunciation Notes: Basic Word Order",
    "content": "Spoken stress, weak forms, intonation, and articulation patterns for Basic Word Order."
  },
  "controlledPractice": [
    {
      "question": "Which sentence has correct English word order?",
      "targetStructure": "word-order",
      "options": [
        "Pizza I like.",
        "I like pizza.",
        "Like I pizza."
      ],
      "correctOptionIndex": 1,
      "explanation": "English follows Subject → Verb → Object: I like pizza."
    },
    {
      "question": "Fix the word order: 'Football play they.'",
      "targetStructure": "word-order",
      "options": [
        "They play football.",
        "Play they football.",
        "Football they play."
      ],
      "correctOptionIndex": 0,
      "explanation": "Subject (they) comes first, then the verb (play), then the object (football)."
    },
    {
      "question": "In 'The children eat breakfast', what is the object?",
      "targetStructure": "word-order",
      "options": [
        "The children",
        "eat",
        "breakfast"
      ],
      "correctOptionIndex": 2,
      "explanation": "The object receives the action · breakfast is what is eaten."
    }
  ],
  "freerPractice": {
    "title": "Freer Practice: Basic Word Order",
    "content": "Guided communicative exchanges applying Basic Word Order in everyday conversation.",
    "links": [
      "COSYgames/scene_match"
    ]
  },
  "production": {
    "title": "Communicative Production: Basic Word Order",
    "content": "Independent oral production and real-world task execution using Basic Word Order.",
    "links": [
      "COSYevents/speaking-club"
    ]
  }
}
