{
  "unitId": "EN-A1-THERE-WAS-WERE-01",
  "title": "There was/were & There will be",
  "level": "A1",
  "language": "en",
  "leadIn": {
    "title": "Lead-In & Context: There was/were & There will be",
    "content": "Existence in past and future: Yesterday there was a party in the street. Tomorrow there will be a concert in the park."
  },
  "meaningCheck": [
    {
      "question": "Function check: What is the primary purpose of using There was/were & There will be?",
      "targetStructure": "there-was-were",
      "options": [
        "To express clear, level-appropriate meaning in structured context",
        "To translate sentences word-for-word from another language",
        "It is an obsolete form never used by native speakers"
      ],
      "correctOptionIndex": 0,
      "explanation": "Correct · This structure provides explicit grammatical function and clarity."
    },
    {
      "question": "Form check: Does correct usage of There was/were & There will be require matching subject, verb, and modifier agreements?",
      "targetStructure": "there-was-were",
      "options": [
        "No, agreement rules are optional in English",
        "Yes, matching grammatical forms ensures natural, accurate communication",
        "Agreement only matters in formal academic writing"
      ],
      "correctOptionIndex": 1,
      "explanation": "Correct · Accurate form and agreement choices prevent misunderstandings."
    }
  ],
  "form": {
    "title": "Form & Structure: There was/were & There will be",
    "content": "Past: There was (singular) / There were (plural). Future: There will be + noun (singular & plural)."
  },
  "pronunciation": {
    "title": "Pronunciation Notes: There was/were & There will be",
    "content": "Spoken stress, weak forms, intonation, and articulation patterns for There was/were & There will be."
  },
  "controlledPractice": [
    {
      "question": "'There ___ many people at the party.'",
      "targetStructure": "there-was-were",
      "options": [
        "was",
        "were",
        "will"
      ],
      "correctOptionIndex": 1,
      "explanation": "Many people is plural → there were."
    },
    {
      "question": "Fix: 'There will a test tomorrow.'",
      "targetStructure": "there-was-were",
      "options": [
        "There will be a test tomorrow.",
        "There will is a test tomorrow.",
        "There be will a test tomorrow."
      ],
      "correctOptionIndex": 0,
      "explanation": "The future form needs 'be': there will be."
    },
    {
      "question": "Which talks about something that no longer exists?",
      "targetStructure": "there-was-were",
      "options": [
        "There is a cat.",
        "There was a cat.",
        "There will be a cat."
      ],
      "correctOptionIndex": 1,
      "explanation": "'There was' places the existence in the past."
    }
  ],
  "freerPractice": {
    "title": "Freer Practice: There was/were & There will be",
    "content": "Guided communicative exchanges applying There was/were & There will be in everyday conversation.",
    "links": [
      "COSYgames/scene_match"
    ]
  },
  "production": {
    "title": "Communicative Production: There was/were & There will be",
    "content": "Independent oral production and real-world task execution using There was/were & There will be.",
    "links": [
      "COSYevents/speaking-club"
    ]
  }
}
