{
  "unitId": "EN-A1-PART-11-QUESTIONS-NEGATION-01",
  "title": "Questions & Negation",
  "level": "A1",
  "language": "en",
  "leadIn": {
    "title": "Lead-In & Context: Questions & Negation",
    "content": "Asking and denying: 'Do you live in London?' — 'No, I don't live in London, I live in Manchester.'"
  },
  "meaningCheck": [
    {
      "question": "Function check: What is the primary purpose of using Questions & Negation?",
      "targetStructure": "part-11-questions-negation",
      "options": [
        "To express clear, level-appropriate meaning in structured context",
        "To translate sentences word-for-word from another language",
        "It is an obsolete form never used by native speakers"
      ],
      "correctOptionIndex": 0,
      "explanation": "Correct · This structure provides explicit grammatical function and clarity."
    },
    {
      "question": "Form check: Does correct usage of Questions & Negation require matching subject, verb, and modifier agreements?",
      "targetStructure": "part-11-questions-negation",
      "options": [
        "No, agreement rules are optional in English",
        "Yes, matching grammatical forms ensures natural, accurate communication",
        "Agreement only matters in formal academic writing"
      ],
      "correctOptionIndex": 1,
      "explanation": "Correct · Accurate form and agreement choices prevent misunderstandings."
    }
  ],
  "form": {
    "title": "Form & Structure: Questions & Negation",
    "content": "Questions: Auxiliary verb (Do/Does/Is/Are) + subject + main verb? Negation: Subject + auxiliary + not + main verb."
  },
  "pronunciation": {
    "title": "Pronunciation Notes: Questions & Negation",
    "content": "Spoken stress, weak forms, intonation, and articulation patterns for Questions & Negation."
  },
  "controlledPractice": [],
  "freerPractice": {
    "title": "Freer Practice: Questions & Negation",
    "content": "Guided communicative exchanges applying Questions & Negation in everyday conversation.",
    "links": [
      "COSYgames/scene_match"
    ]
  },
  "production": {
    "title": "Communicative Production: Questions & Negation",
    "content": "Independent oral production and real-world task execution using Questions & Negation.",
    "links": [
      "COSYevents/speaking-club"
    ]
  }
}
