{
  "unitId": "EN-A1-ADJECTIVES-01",
  "title": "Adjectives",
  "level": "A1",
  "language": "en",
  "leadIn": {
    "title": "Lead-In & Context: Adjectives",
    "content": "Look at this car: it is fast, red, and new. Adjectives describe nouns and tell us more about people, places, and things."
  },
  "meaningCheck": [
    {
      "question": "Function check: What is the primary purpose of using Adjectives?",
      "targetStructure": "adjectives",
      "options": [
        "To express clear, level-appropriate meaning in structured context",
        "To translate sentences word-for-word from another language",
        "It is an obsolete form never used by native speakers"
      ],
      "correctOptionIndex": 0,
      "explanation": "Correct · This structure provides explicit grammatical function and clarity."
    },
    {
      "question": "Form check: Does correct usage of Adjectives require matching subject, verb, and modifier agreements?",
      "targetStructure": "adjectives",
      "options": [
        "No, agreement rules are optional in English",
        "Yes, matching grammatical forms ensures natural, accurate communication",
        "Agreement only matters in formal academic writing"
      ],
      "correctOptionIndex": 1,
      "explanation": "Correct · Accurate form and agreement choices prevent misunderstandings."
    }
  ],
  "form": {
    "title": "Form & Structure: Adjectives",
    "content": "Adjective + noun (a red car) OR Subject + verb 'be' + adjective (the car is red). Adjectives never change for plural nouns."
  },
  "pronunciation": {
    "title": "Pronunciation Notes: Adjectives",
    "content": "Spoken stress, weak forms, intonation, and articulation patterns for Adjectives."
  },
  "controlledPractice": [
    {
      "question": "Correct order?",
      "targetStructure": "adjectives",
      "options": [
        "a beautiful woman",
        "a woman beautiful",
        "a beautifuls woman"
      ],
      "correctOptionIndex": 0,
      "explanation": "Adjectives go before the noun: a beautiful woman."
    },
    {
      "question": "'I have three red ___.' (apple)",
      "targetStructure": "adjectives",
      "options": [
        "apple",
        "apples",
        "appleses"
      ],
      "correctOptionIndex": 1,
      "explanation": "The noun takes the plural, not the adjective: red apples."
    },
    {
      "question": "Adjectives in English:",
      "targetStructure": "adjectives",
      "options": [
        "go after the noun",
        "go before the noun",
        "can take a plural -s"
      ],
      "correctOptionIndex": 1,
      "explanation": "English adjectives always come before the noun they describe."
    }
  ],
  "freerPractice": {
    "title": "Freer Practice: Adjectives",
    "content": "Guided communicative exchanges applying Adjectives in everyday conversation.",
    "links": [
      "COSYgames/scene_match"
    ]
  },
  "production": {
    "title": "Communicative Production: Adjectives",
    "content": "Independent oral production and real-world task execution using Adjectives.",
    "links": [
      "COSYevents/speaking-club"
    ]
  }
}
